{
  "$schema": "https://json-schema.org/draft/2020-12/schema",
  "$id": "https://authorizedretailers.ai/schemas/0.1/verify-response.json",
  "title": "POST /v0/verify response (section 9)",
  "type": "object",
  "required": ["status", "tier", "checked", "valid_until", "signals", "signature"],
  "additionalProperties": false,
  "properties": {
    "status": { "enum": ["authorized", "unlisted", "expired", "brand_unverified", "disputed"] },
    "tier": { "enum": ["self_published", "brand_attested", "observed", null] },
    "reason": { "enum": ["not_registered", "domain_unlinked", "verification_lapsed"] },
    "authorization_id": { "$ref": "common.json#/$defs/id" },
    "expires": { "$ref": "common.json#/$defs/timestamp" },
    "checked": { "$ref": "common.json#/$defs/timestamp" },
    "valid_until": { "$ref": "common.json#/$defs/timestamp" },
    "signals": {
      "type": "array",
      "items": {
        "type": "object",
        "required": ["type", "observed"],
        "additionalProperties": false,
        "properties": {
          "type": { "type": "string", "pattern": "^[a-z][a-z0-9_]{0,63}$" },
          "observed": { "$ref": "common.json#/$defs/timestamp" },
          "detail": { "type": "string", "maxLength": 1024 }
        }
      }
    },
    "signature": { "$ref": "common.json#/$defs/signature" }
  },
  "allOf": [
    {
      "if": { "properties": { "status": { "const": "brand_unverified" } } },
      "then": {
        "properties": { "tier": { "const": null } },
        "not": { "anyOf": [{ "required": ["authorization_id"] }, { "required": ["expires"] }] }
      },
      "else": {
        "properties": { "tier": { "type": "string" } },
        "not": { "required": ["reason"] }
      }
    },
    {
      "if": { "properties": { "status": { "enum": ["authorized", "expired", "disputed"] } } },
      "then": { "required": ["authorization_id", "expires"] }
    },
    {
      "if": { "properties": { "status": { "const": "unlisted" } } },
      "then": { "not": { "anyOf": [{ "required": ["authorization_id"] }, { "required": ["expires"] }] } }
    }
  ]
}
