{
  "status": "disputed",
  "tier": "brand_attested",
  "authorization_id": "auth_01J9X2",
  "expires": "2026-12-22T00:00:00Z",
  "checked": "2026-09-23T14:02:11Z",
  "valid_until": "2026-09-24T14:02:11Z",
  "signals": [],
  "signature": {
    "kid": "ar-2026-09",
    "jws": "eyJhbGciOiJFZERTQSIsImtpZCI6ImFyLTIwMjYtMDkifQ..c2lnbmF0dXJlLXBsYWNlaG9sZGVy"
  }
}
